,Number,Name,Website,Description,City,Country,Sector,Sub-Sector
6122,3080,LeagueLobster,http://leaguelobster.com,"The leader in sports scheduling – leagues and tournaments, big and smal",New York City,USA,Management & Organisation,Organisations & Venues
5093,3081,LeagueOS,http://leagueos.gg,End to end esports league management platform,Minneapolis,USA,Management & Organisation,Organisations & Venues
2616,3082,LeaguePals Inc,http://leaguepals.com,Enable league bowlers to pay their league dues with a credit card and join leagues around their neighborhood,West Milford,USA,Management & Organisation,Organisations & Venues
4861,3083,LeagueRepublic,http://leaguerepublic.com,"Web and mobile app software to manage scheduling, results, statistics, players, news and communication of sports leagues",Wolverhampton,UK,Management & Organisation,Organisations & Venues
4797,3084,LeagueSafe,http://leaguesafe.com,Managing fantasy sports payments and dues,Minneapolis,USA,Fans & Content,Fantasy Sports & Betting
3554,3085,LeagueSide,http://leagueside.com,enables brands to directly reach the 35 million families involved in youth sports,Philadelphia,USA,Management & Organisation,Media & Sponsors
4290,3086,LeagueX,http://leaguex.com,The Ultimate Fantasy Sports App. Show off your sports knowledge by picking squads and win real money daily,Bangalore,India,Fans & Content,Fantasy Sports & Betting
930,3087,LeagueZONE,http://LeagueZONE.com,League management software,Washington D.C.,USA,Management & Organisation,Organisations & Venues
856,3088,Leaguemanager,http://leaguemanager-software.com,Complete league and event management software,Melbourne,Australia,Management & Organisation,Organisations & Venues
4474,3089,Leaguer,http://leaguer.org,a free league & team management software,New York City,USA,Management & Organisation,Organisations & Venues
1441,3090,Leagues,http://leagues.gg,Leagues is a platform for esports,Copenhagen,Denmark,Activity & Performance,Before / After Activity
2064,3091,Leaguescape,http://leaguescape.com,Daily fantasy sports platform for NFL,Denver,USA,Fans & Content,Fantasy Sports & Betting
1168,3092,Leap Token,http://leaptoken.io,"web3 sports ecosystem, enabling talents, fans, and talent seekers to enjoy competition through a user-friendly experience",Rosh Haayin,Israel,Fans & Content,Fantasy Sports & Betting
1367,3093,Learn MatchUp and Play Sports,http://learnmatchupandplay.com,Platform to find coaches to learn new sports,Singapore,Singapore,Activity & Performance,Before / After Activity
3453,3094,Learn to Win,http://learntowin.us,App-based sport micro-learning platform,Palo Alto,USA,Activity & Performance,For Activity Software
158,3095,Learnwake,http://learnwake.com,YouTube based wakeboarding tutorials,Clermont,USA,Activity & Performance,For Activity Software
756,3096,LedsReact,http://ledsreact.be,Light based smart sports cone to direct training,Wevelgem,Belgium,Activity & Performance,For Activity Hardware
771,3097,Leeg,http://leeg.live,Skill-based mobile gaming platform.,Singapore,Singapore,Fans & Content,Fantasy Sports & Betting
776,3098,Leet,http://leet.mt,Football booking platform,-,-,Activity & Performance,Before / After Activity
4538,3099,Leetify,http://leetify.com,"We help gamers identify their weaknesses, work on those weaknesses and track their progression",Stockholm,Sweden,Activity & Performance,For Activity Software
2400,3100,Lefit,http://lefit.com,App based fitness tutorials platform,Hangzhou,China,Activity & Performance,For Activity Software
4918,3101,Left Wing Lock,http://leftwinglock.com,a fantasy hockey website that provides free and premium tools for managers of fantasy hockey teams,Washington D.C.,USA,Fans & Content,Fantasy Sports & Betting
2389,3102,Legacy Esports,http://legacyesports.com,Esports league competition management software,Chicago,USA,Management & Organisation,Organisations & Venues
2868,3103,Legacy League,http://legacyleague.com,NFT marketplace for College Athletes,Chapel Hill,USA,Fans & Content,Fan Experiences
2343,3104,Legal Sports Report,http://legalsportsreport.com,Sports Betting news and tips,Las Vegas,USA,Fans & Content,Fantasy Sports & Betting
2748,3105,Legends,http://legends.net,"Legends works on designing, planning and creating exceptional experiences in sports and entertainment.",New York City,USA,Management & Organisation,Organisations & Venues
2537,3106,Legends,http://footballapplegends.com,the first global grassroots football network,Puzol,Spain,Fans & Content,Fan Experiences
4275,3107,Legends,http://buildlegends.com,confidence-training platform for kids,Los Angeles,USA,Activity & Performance,For Activity Software
3592,3108,Legionfarm,http://legionfarm.com,connects gamers with in-game training and assistance from professional players,Delaware,USA,Activity & Performance,Before / After Activity
5317,3109,Leikr,http://leikr.com,Wristband for endurance training and referee assistance,Glostrup,Denmark,Activity & Performance,For Activity Hardware
3800,3110,Lelapa,http://lelapa.com.au,Lelapa is a wellness platform which connects people and community who are passionate.,Sydney,Australia,Activity & Performance,Before / After Activity
278,3111,Lemeister,http://lemeister.com,Sports analytics software solution,Toronto,Canada,Activity & Performance,For Activity Software
4588,3112,Lenus,http://lenusehealth.com,Platform for health and fitness professionals build a strong and sustainable online business,Copenhagen,Denmark,Activity & Performance,Before / After Activity
3918,3113,Leomo,http://leomo.io,Wearable motion analysis device and video analysis solution,Newport Beach,USA,Activity & Performance,For Activity Hardware
4611,3114,Leostep,http://leobit.com,Leostep is a gamified fitness app,Lviv,Ukraine,Activity & Performance,For Activity Software
5689,3115,Les Bornees,http://lesbornees.com,Online women's cycling community,Paris,France,Fans & Content,Fan Experiences
5668,3116,Les Dechaines,http://lesdechaines.fr,a sports company that allows users and clients to book a tennis court in seconds,Paris,France,Activity & Performance,Before / After Activity
3557,3117,Lets Join In,http://letsjoinin.com,Sports social discussion platform,Ashburton,Australia,Fans & Content,Fan Experiences
2426,3118,Lets Live,http://letslive.com.au,an action sports social network and directory application,Sydney,Australia,Activity & Performance,Before / After Activity
972,3119,Letshang,http://letshang.live,HANG with your sports heroes as they watch with you!,New York City,USA,Fans & Content,Fan Experiences
1645,3120,Let’s Do This,http://letsdothis.com,Endurance sports booking platform,London,UK,Activity & Performance,Before / After Activity
1682,3121,Level Up Sports,http://levelupsportz.com,App for students create athletic profiles to get recruited by colleges,New York City,USA,Activity & Performance,Before / After Activity
2261,3122,LevelChanger,http://levelchanger.com,"Real-time scoring, stats, and analytics for wrestling teams",Palo Alto,USA,Management & Organisation,Organisations & Venues
3476,3123,LevelPlay Sports,http://levelplaysports.com,SaaS platform for the world's Athletes and Coaches,Los Angeles,USA,Activity & Performance,Before / After Activity
2568,3124,LevelUpBasket.com,http://levelupbasket.com,"“Strava” for Basketball: community with gamification for 500M basketball players & tools for coaches, kids, parents and scouters.",Wilmington,USA,Activity & Performance,For Activity Software
1698,3125,Lever Health,http://leverhealth.com,Lever is a personalized coaching platform designed to help you meet your health goals.,New York City,USA,Activity & Performance,For Activity Software
4964,3126,Leverage Sports,http://lvrgsports.co,"virtual experiences that enhance engagement, cultural relevancy, and social currency for sports brands",Houston,USA,Management & Organisation,Organisations & Venues
880,3127,Levitty,http://levitty.com,Levitty designs and manufactures racing simulators,Bilbao,Spain,Activity & Performance,For Activity Hardware
124,3128,Levuro,http://levuro.com,Social marketing tools for better fan engagement,Zurich,Switzerland,Fans & Content,Fan Experiences
5299,3129,Lexington Sports & Social Club,http://lexingtonsocial.com,sports leagues and social events for adults 21 years old and up,Lexington,USA,Fans & Content,Fan Experiences
6178,3130,Libera Akademio,http://ligatenis10.com.br,Discover and register for tennis events,Rio De Janeiro,Brazil,Activity & Performance,Before / After Activity
759,3131,Life Cykul,http://lifecykul.com,Sports games and venues booking platform,Hyderabad,India,Activity & Performance,Before / After Activity
1196,3132,Lifestyle Updated,http://lifestyleupdated.com,The online fitness platform that takes customization workout programs according to your preferences,-,-,Activity & Performance,For Activity Software
2371,3133,Liftopia,http://liftopia.com,Discover lift ticket deals for ski resorts,San Francisco,USA,Activity & Performance,Before / After Activity
5352,3134,LigApp,http://laligapp.com,A digital platform that manages the administration of sports leagues and tournaments.,Santiago,Chile,Management & Organisation,Organisations & Venues
550,3135,Liga Retro,http://ligaretro.com.br,Retro is specialized in the production and sale of replicas of old shirts from teams and football teams in addition to other sports.,Rio De Janeiro,Brazil,Fans & Content,Fan Experiences
4160,3136,LigaOlahraga,http://ligaolahraga.com,Sports news portal,Jakarta,Indonesia,Fans & Content,Content Platforms
5887,3137,Ligalytics,http://ligalytics.com,Sports match scheduling services,Frankfurt,Germany,Management & Organisation,Organisations & Venues
5614,3138,Light in Fitness,http://lightinfitness.com,Professional weight machines and fitness equipment,Tours,France,Activity & Performance,For Activity Hardware
6139,3139,Lightweave,http://lightweave.co,Digital agency specialising in Virtual Reality (VR) and Augmented Reality (AR),Brisbane,Australia,Management & Organisation,Media & Sponsors
4223,3140,LikeAGlove,http://likeaglove.me,Bluetooth shorts to measure body dimensions,Petah Tikva,Israel,Activity & Performance,For Activity Hardware
2435,3141,Lillius,http://lillius.net,Lillius is a sports technology firm that provides bespoke digital sports coaching services.,-,#N/A,Activity & Performance,Before / After Activity
1034,3142,Line and Length Mats,http://lineandlengthmats.com,Coach and umpire safety helmet,Leeds,UK,Activity & Performance,For Activity Hardware
1831,3143,LineMeUp,http://linemeup.fr,Fantasy sports tips and analytics,Paris,France,Fans & Content,Fantasy Sports & Betting
4974,3144,LineStar,http://linestarapp.com,Daily fantasy sports analytics and tips,San Diego,USA,Fans & Content,Fantasy Sports & Betting
627,3145,LineUpEXplorers,http://luex.com,Surfing and Skiing trips booking platform,Munich,Germany,Activity & Performance,Before / After Activity
3846,3146,Lineups,http://lineups.com,"Sports Betting analytics, news and tips",Irvine,USA,Fans & Content,Fantasy Sports & Betting
3448,3147,Link My Ride,http://linkmyride.com,"A cycling community app that allows riders, clubs, and brands to connect",Amstelveen,The Netherlands,Activity & Performance,Before / After Activity
5485,3148,Link Sports,http://linksports.co.jp,Multisport team management platform,Tokyo,Japan,Management & Organisation,Organisations & Venues
6292,3149,Linkup Point,http://linkup-point.com,"Sports and Recreation focused social network that finds sports partners, mentors, guides, trips, and information.",Colorado Springs,USA,Activity & Performance,Before / After Activity
5388,3150,Linx IAS,http://linxias.com,Headgear to monitor head impact,Rochester,USA,Activity & Performance,For Activity Hardware
5610,3151,Liquiditeam,http://liquidi.team,"Web3 fan engagement solutions for content creators, professional sports clubs, athletes, and more.",Braunschweig,Germany,Fans & Content,Fan Experiences
78,3152,List and Ride,http://listnride.com,The booking platform for bicycle hire and cycling activities in Europe,Berlin,Germany,Activity & Performance,Before / After Activity
3147,3153,Lit Method,http://litmethod.com,Smart workout equipment,Los Angeles,USA,Activity & Performance,For Activity Hardware
4291,3154,Liteboxer,http://liteboxer.com,a provider of a digital fitness platform used to provide an engaging full-body boxing workout,Boston,USA,Activity & Performance,For Activity Software
5094,3155,Littleboydesign,http://weightplan.com,Workout plans and fitness tracker,Hemel Hempstead,UK,Activity & Performance,For Activity Software
3191,3156,Livall Riding,http://livall.com,Smart urban helmet with in-built communication and music,Shenzhen,China,Activity & Performance,For Activity Hardware
5763,3157,Live Graphic Systems,http://ligrsystems.com,Automatic graphics and animations for live sports streams,Sydney,Australia,Management & Organisation,Media & Sponsors
1994,3158,Live Penalty,http://livepenalty.com,Live multiplayer game where digital players compete against real athletes,Prague,Czech Republic,Fans & Content,Fantasy Sports & Betting
5208,3159,Live Replayer / Future Sports Media,http://livereplayer.com,Software for professional sports broadcasting,Stockholm,Sweden,Management & Organisation,Media & Sponsors
1026,3160,Live Soccer Scores,http://livesoccerscores.net,Football scores and results,London,UK,Fans & Content,Content Platforms
3161,3161,Live Sports Markets,http://livesportsmarkets.com,Fantasy sports platform,New York City,USA,Fans & Content,Fantasy Sports & Betting
5773,3162,Live Tech Games,http://livetechgames.com,Live Tech Games is pioneering a new wave in Mobile Entertainment.,London,UK,Fans & Content,Fan Experiences
4898,3163,Live4Well,http://live4well.io,Live4Well uses blockchain technology to create a wellness ecosystem.,Hong Kong,Hong Kong,Management & Organisation,Organisations & Venues
357,3164,LiveBarn,http://livebarn.com,OTT for live amateur / youth sports and highlights,Montreal,Canada,Fans & Content,Content Platforms
6131,3165,LiveDuel,http://liveduel.com,a social gaming site that allowing community members to cross-tabulate sports predictions,Cork,Ireland,Fans & Content,Fan Experiences
5327,3166,LiveExercise,http://liveexercise.com,Live and On Demand Resistance Bands Workouts,Boca Raton,USA,Activity & Performance,For Activity Software
1229,3167,LiveLike,http://livelike.com,Fan engagement monetization solution,New York City,USA,Fans & Content,Fan Experiences
2996,3168,LiveMode,http://livemode.com,Works with sports entities to maximize digital presence and develop profitable business models with social and streaming platforms,Rio De Janeiro,Brazil,Fans & Content,Content Platforms
1076,3169,LiveRowing,http://liverowing.com,Rowing app to row live with other users and measure performance,Denver,USA,Activity & Performance,For Activity Software
3917,3170,LiveRun,http://liverunapp.com,"Live Run is an app that allows people in different locations to connect in real time through running, yoga, muscle training, etc.",Tokyo,Japan,Activity & Performance,For Activity Software
648,3171,LiveScore Group,http://livescoregroup.com,LiveScore Group is a one of the real-time sports updates and streaming service providers.,London,UK,Fans & Content,Fantasy Sports & Betting
2561,3172,LiveSmart,http://getlivesmart.com,Health assessments and guidance for corporate workforce,London,UK,Activity & Performance,For Activity Software
5651,3173,LiveSoccer,http://livesoccer.io,Football scores and results,Coimbra,Portugal,Fans & Content,Content Platforms
4592,3174,LiveU,http://liveu.tv,Live broadcasting services provider,Hackensack,USA,Management & Organisation,Media & Sponsors
2088,3175,Livefit Australia,http://livefitaustralia.com,"Not-for-profit enterprise aiming to improve the health, fitness and nutrition",Bassendean,Australia,Activity & Performance,For Activity Software
4644,3176,Liveheats,http://liveheats.com,Live scoring and competition management for action sports,Sydney,Australia,Management & Organisation,Organisations & Venues
2749,3177,Livekick,http://livekick.com,"Two-Way Live Streaming Video for people who wants to do yoga, meditation, and total fitness",New York City,USA,Activity & Performance,For Activity Software
2795,3178,Livement,http://livement.com,Livement sells tickets and concessions for sports stadiums from mobile phones.,Guadalajara,Mexico,Fans & Content,Fan Experiences
4202,3179,Livescore365,http://livescore007.com,Football scores and results,Hanoi,Vietnam,Fans & Content,Fantasy Sports & Betting
5682,3180,Livesport,http://livesport.eu,Live sports scores and results,Prague,Czech Republic,Fans & Content,Content Platforms
4320,3181,Livin Horse Shop,http://livinhorseshop.nl,Livin Horse Shop is an online store for equestrian sports products.,Lutte,The Netherlands,Activity & Performance,For Activity Hardware
5759,3182,Lizbazi,http://lizbazi.app,App that provides skiing information,Tehran,Iran,Fans & Content,Fan Experiences
6318,3183,Loaded Gamer,http://loadedgamer.com,Premier community for play-to-earn games and Axie Infinity news & info.,Portsmouth,USA,Fans & Content,Content Platforms
964,3184,Local Sports Network,http://localsports.network,A digital community that connects you to the people you know and the schools you love,Austin,USA,Fans & Content,Fan Experiences
855,3185,LocalRaces,http://localraces.com,an event management platform that provides technology to create experiences and make event management profitable,Joplin,USA,Activity & Performance,Before / After Activity
4944,3186,Locker,http://getlocker.com,Sports media platform,Galway,Ireland,Fans & Content,Content Platforms
529,3187,Locker Room,http://joinlockerroom.com,A social audio app where fans can talk sports and spontaneously join live conversations,Los Angeles,USA,Fans & Content,Content Platforms
2697,3188,Lockeroom Chat,http://lockeroomchat.com,Community sports chat platform,Las Vegas,USA,Fans & Content,Fantasy Sports & Betting
317,3189,Loco,http://loco.gg,Esports streaming app,Mumbai,India,Fans & Content,Content Platforms
185,3190,Locomotion Data Solutions,http://locomotiondata.com,End to end connectivity for gym users and owners,Haifa,Israel,Management & Organisation,Organisations & Venues
5601,3191,Logitix,http://logitix.com,Ticketing platform that combines pricing optimization and real-time ticket processing with real-time insights,Boca Raton,USA,Fans & Content,Fan Experiences
5570,3192,Loglig,http://loglig.com,Social system management application integrated sports associations,Misgav,Israel,Management & Organisation,Organisations & Venues
3574,3193,Lomcage,http://lomcage.com,Visual device that helps goalkeepers train,Irun,Spain,Activity & Performance,Before / After Activity
4783,3194,Lone Star Gridiron,http://lonestargridiron.com,American football content platform,Wimberley,USA,Fans & Content,Content Platforms
5493,3195,LongoMatch,http://longomatch.com,a video analyzing tool for team based sports developed by Fluendo,Barcelona,Spain,Activity & Performance,For Activity Software
3777,3196,Looking for a team,http://lookingforateam.com,"Social network platform for esports players, team managers and coaches.",Barcelona,Spain,Management & Organisation,Organisations & Venues
5154,3197,LoopGolf,http://joinloopgolf.co,Golf's premium betting app.,San Francisco,USA,Fans & Content,Fantasy Sports & Betting
2651,3198,Loopgolf,http://loopgolf.co,Loop helps you get the best tee times at the busiest courses,Redwood City,USA,Activity & Performance,Before / After Activity
3859,3199,Looplay,http://looplay.app,Sports Streaming Service,Dubai,UAE,Activity & Performance,Before / After Activity
2816,3200,LootMogul,http://lootmogul.com,"LootMogul is an athlete-led sports metaverse web3 platform that uses blockchain games, meta stores for brands and players.",Santa Monica,USA,Fans & Content,Fan Experiences
790,3201,Lose It!,http://loseit.com,Lose It! is a popular calorie counting app available on iOS and Android that is mobilizing the world to achieve a healthy weight.,Boston,USA,Activity & Performance,For Activity Software
2374,3202,Lotus Flow,http://lotusflow.com,"Lotus Flow is an online yoga, fitness, pilates and mindfulness platform that offers both audio and video content in 12 languages.",Ankara,Turkey,Activity & Performance,For Activity Software
3499,3203,Lotus Yoga,http://lotusyogaapp.com,"Lotus Yoga is an online yoga, meditation, fitness, and mindfulness platform that offers both audio and video content in various languages.",Ankara,Turkey,Activity & Performance,For Activity Software
4324,3204,Loudstand,http://loudstand.com,real-time fan engagement analytics to sports clubs,Copenhagen,Denmark,Fans & Content,Fan Experiences
5073,3205,Loupe App,http://loupetheapp.com,Sports collectibles,Sunrise,USA,Fans & Content,Fan Experiences
4365,3206,Lowcal App,http://lowcalapps.com,A mobile app that helps you live a healthier and happier life through scientifically proven nutrition/workout plans,Dubai,UAE,Activity & Performance,For Activity Software
2375,3207,Lowkey.gg,http://lowkey.gg,"Capture, relive, and share your best gaming moments",Cambridge,USA,Management & Organisation,Media & Sponsors
2912,3208,Lsee,http://lsee.com,Metabolism tracker with app to analyse and report data,Paris,France,Activity & Performance,For Activity Hardware
2312,3209,Lucid App,http://getlucid.com,an app to help athletes train their mind to improve their athletic ability,San Francisco,USA,Activity & Performance,For Activity Software
1116,3210,Lucid Travel,http://lucidtravel.us,Travel software built for sports teams,Raleigh,USA,Activity & Performance,Before / After Activity
1923,3211,Luckbox,http://luckbox.com,Esports focused betting platform,Douglas,Isle of Man,Fans & Content,Fantasy Sports & Betting
4559,3212,Lucra Sports,http://lucrasports.com,A social sports gaming platform,Los Angeles,USA,Fans & Content,Fantasy Sports & Betting
2224,3213,Ludex,http://ludex.com,Sports and trading card scanning app that accurately identifies and tracks the value of your card collection.,Chicago,USA,Fans & Content,Fantasy Sports & Betting
2837,3214,Ludimos,http://ludimos.com,Online app based cricket coaching platform,Amsterdam,The Netherlands,Activity & Performance,For Activity Software
3946,3215,Ludum,http://ludum.com,Athlete management platform,Cambridge,UK,Activity & Performance,For Activity Software
2553,3216,Ludus Alliance,http://ludusalliance.shop,Smart tracking equipment,Givat Brenner,Israel,Activity & Performance,For Activity Hardware
2581,3217,Lumen,http://lumen.me,a device and app that measures metabolism through the breath,Ramat Hasharon,Israel,Activity & Performance,For Activity Hardware
3342,3218,Lumin Sports Technology,http://luminsports.com,Data Visualisation Tool that can replace an Athlete Management System,Adelaide,Australia,Activity & Performance,For Activity Software
63,3219,LumosTech,http://lumostech.co,Smart sleep mask to measure sleep patterns,San Francisco,USA,Activity & Performance,For Activity Hardware
1986,3220,Lunatix,http://tickets.lunatix.com,Ticket booking platform,New York City,USA,Fans & Content,Fan Experiences
3078,3221,LunchTable,http://lunchtable.ai,Fan activation platform,Cincinnati,USA,Fans & Content,Fan Experiences
3,3222,Lupa,http://wearelupa.com,The world’s smartest running coach that guides you through your run,London,UK,Activity & Performance,For Activity Software
3268,3223,Luv Seats,http://luvseats.com,Ticketing and booking app,Las Vegas,USA,Fans & Content,Fan Experiences
3691,3224,Lvision,http://lvision.io,Real-time computer vision analysis for sports betting,Ashkelon,Israel,Fans & Content,Fantasy Sports & Betting
312,3225,Lympo,http://lympo.com,Sports NFT platform,Vilnius,Lithuania,Fans & Content,Fan Experiences
6194,3226,Lystics,http://lystics.com,Fantasy Aussie Rules Football platform,Yarraville,Australia,Fans & Content,Fantasy Sports & Betting
4144,3227,M80,http://m80.gg,The next-generation organization created for the esports and video game lovers of today. Its constructing the creative economy of the future through esports and content.,Boston,USA,Fans & Content,Fan Experiences
3989,3228,MAGPIE,http://yourmagpie.com,"A digital platform to automate pricing, inventory and sales for collectible dealers and sellers",New York City,USA,Fans & Content,Fan Experiences
3746,3229,MAKEACHAMP,http://makeachamp.com,Crowdfunding for sports initiatives,Montreal,Canada,Fans & Content,Fan Experiences
5930,3230,MANY Digital,http://manydigital.com,White-label App and custom back-end fan engagement platform,Midtjylland,Denmark,Fans & Content,Fan Experiences
4676,3231,MARCA,http://marca.com,Football news portal,Madrid,Spain,Fans & Content,Content Platforms
5692,3232,MATCHi,http://matchi.se,"best connections between racket sports facilities and players to know where, when and with whom you can play",Gothenburg,Sweden,Activity & Performance,Before / After Activity
2830,3233,MCES,http://mces.gg,Esports coaching and booking facilites,Marseille,France,Activity & Performance,Before / After Activity
3170,3234,MDXD Telehealth Solutions,http://mdxd.com.au,Connecting real life to games for fitness,Sydney,Australia,Activity & Performance,Before / After Activity
4352,3235,MEGPlay,http://megplay.com,Esports and gaming community,Kuala Lumpur,Malaysia,Fans & Content,Content Platforms
4928,3236,MFit Personal,http://mfitpersonal.com.br,Personal fitness training videos app,Porto Belo,Brazil,Activity & Performance,For Activity Software
4338,3237,MHS Equestrian - Mini Horse Shop,http://minihorseshop.nl,"Mini Horse Shop is a webshop for horse racing equipment, everything you need for horse, cornwall, rider and stable & yard.",Huissen,The Netherlands,Activity & Performance,For Activity Hardware
3670,3238,MIBODY,http://mibody.ca,The next generation of multigym machine with IoT functionalities and mobile application,Pully,Switzerland,Activity & Performance,Before / After Activity
3790,3239,MIRA Rehab,http://mirarehab.com,Gamifying physical therapy through sensors,London,UK,Activity & Performance,Before / After Activity
