,Number,Name,Website,Description,City,Country,Sector,Sub-Sector
888,1675,Fanprime,http://fanprime.io,SaaS blockchain based white label solution for Sports & Entertainment rights holders,Paris,France,Fans & Content,Fan Experiences
3445,1676,Fans League,http://fans-league.club,"Mobile-based game for fans, turning fandom into a sport, by gamifying and rewarding every-day fan actions.",Tel-Aviv,Israel,Fans & Content,Fan Experiences
4078,1677,Fans On screen,http://fans-on-screen.com,Enhances fans game day experience at sports events by offering interaction with the main screen at sport arena.,Cleveland,USA,Fans & Content,Fan Experiences
4786,1678,FansRepublic,http://fansrepublic.com,Social network dedicated for football fans to engage in football and share their love of the game,-,-,Fans & Content,Fan Experiences
4713,1679,FansUnite,http://fansunite.com,Technology platform providing solutions for lawful online sports betting,Vancouver,Canada,Fans & Content,Fantasy Sports & Betting
4549,1680,FansXP,http://fansxp.com,Enables Sports Fans experiences in Mobile Apps.,San Mateo,USA,Fans & Content,Fan Experiences
2454,1681,Fansea,http://fansea.io,Fansea is an NFT platform for digital 3D fan collectibles,Frankfurt,Germany,Fans & Content,Fan Experiences
5230,1682,Fanseat,http://fanseat.com,Fanseat is a sports entertainment service optimized for all digital devices,Helsinki,Finland,Fans & Content,Content Platforms
2194,1683,Fansfoot,http://fansfoot.com,"Online community to help 1 billion of football fans to connect, share and laugh, whatever the club they support",Nanterre,France,Fans & Content,Content Platforms
719,1684,Fanslam,http://fanslam.us,Fantasy tennis website offering tournament-long Fantasy Sport contests for free and for cash prizes,-,-,Management & Organisation,Organisations & Venues
1844,1685,Fanspole,http://fanspole.com,Social Fantasy gaming platform,Mumbai,India,Fans & Content,Fantasy Sports & Betting
1360,1686,Fanstreamm,http://fanstreamm.com,Creating sustainable relationships with ticket holders,Cedar Rapids,USA,Fans & Content,Fantasy Sports & Betting
3484,1687,Fanstriker,http://fanstriker.com,Sports media platform dedicated to the fan experience,Paris,France,Fans & Content,Content Platforms
4878,1688,Fansure,http://fansure.com,Analytics based solutions to stakeholders in the sports industry,Belmont,USA,Fans & Content,Fan Experiences
4196,1689,Fansxr,http://fansxr.com,"Delivers the ultimate personalized fan experience using computer vision overlays, and 5G technology, and delivered to any digital device",Las Vegas,USA,Fans & Content,Fan Experiences
1643,1690,Fantag,http://fantag.live,"Enables producers and spectators at live events to capture, relive, and share their favorite moments with the simple touch of the screen",Sacramento,USA,Management & Organisation,Media & Sponsors
1814,1691,Fantasizr,http://fantasizr.com,Web-based platform that enables its users to create fantasy leagues,Los Angeles,USA,Fans & Content,Fantasy Sports & Betting
843,1692,Fantastec,http://fantastec.io,Platforms which enablse globally distanced fans to connect and engage more deeply with the sport they love.,Guildford,UK,Fans & Content,Fan Experiences
3597,1693,Fantastec SWAP,http://fantastec-swap.io,Blockchain based digital collectibles platform,London,UK,Fans & Content,Fan Experiences
1299,1694,Fantasy,http://Fantasyalarm.com,Track professional sports lineup information and breaking news against user-specific fantasy sports rosters.,Huntington Beach,USA,Fans & Content,Fantasy Sports & Betting
993,1695,Fantasy Akhada,http://fantasyakhada.com,Fantasy gaming platform,Delhi NCR,India,Fans & Content,Fantasy Sports & Betting
1405,1696,Fantasy Couch,http://fantasycouch.com,"Guide for fantasy football, fantasy basketball and fantasy baseball.",Sacramento,USA,Fans & Content,Fantasy Sports & Betting
4319,1697,Fantasy Edge,http://FantasyEdge.io,Fantasy sports tips alerts,Washington D.C.,USA,Fans & Content,Fantasy Sports & Betting
3566,1698,Fantasy Football Calculator,http://fantasyfootballcalculator.com,"Mock drafts, ADP data, draft software, lineup analysis, and more",Cleveland,USA,Fans & Content,Fantasy Sports & Betting
5222,1699,Fantasy Football Evolution,http://fantasyfootballevolution.com,Fantasy sports and mock draft platform,Stockertown,USA,Fans & Content,Fantasy Sports & Betting
3047,1700,Fantasy Football Fix,http://fantasyfootballfix.com,Fantasy Football tips and research,Nottingham,UK,Fans & Content,Fantasy Sports & Betting
4023,1701,Fantasy Football Hub,http://fantasyfootballhub.co.uk,Everything you need to dominate at Fantasy Premier League (#FPL) and Fantasy Football under one roof.,Lewes,UK,Fans & Content,Fantasy Sports & Betting
334,1702,Fantasy Football Nerd,http://fantasyfootballnerd.com,Fantasy football rankings from around the internet.,Oshkosh,USA,Fans & Content,Fantasy Sports & Betting
290,1703,Fantasy Footballers,http://thefantasyfootballers.com,A sports and entertainment podcast,Wall Township,USA,Fans & Content,Fantasy Sports & Betting
1443,1704,Fantasy Invest,http://fantasyinvest.club,Play and win with fantasy sports tocks game,Los Angeles,USA,Fans & Content,Fan Experiences
3863,1705,Fantasy Labs,http://fantasylabs.com,Daily fantasy sports analytics,Boston,USA,Fans & Content,Fantasy Sports & Betting
1331,1706,Fantasy Life,http://FantasyLifeApp.com,Social Daily fantasy sports app for news and tips,New York City,USA,Fans & Content,Fantasy Sports & Betting
5182,1707,Fantasy Moguls,http://FantasyMoguls.com,Social Daily fantasy sports app for news and tips,Seattle,USA,Fans & Content,Fantasy Sports & Betting
1382,1708,Fantasy Olympian,http://fantasyolympian.com,"Olympics news, analysis, draft advice and commentary",Chicago,USA,Fans & Content,Fantasy Sports & Betting
6220,1709,Fantasy Outliers,http://fantasyoutliers.com,Fantasy sports research and analysis platform,Cincinnati,USA,Fans & Content,Fantasy Sports & Betting
1763,1710,Fantasy Sharks,http://fantasysharks.com,Sports betting platform,Mesa,USA,Fans & Content,Fantasy Sports & Betting
2007,1711,Fantasy Smarts,http://fantasysmarts.com,Fantasy sports through virtual slot machines,Orange,USA,Fans & Content,Fantasy Sports & Betting
2915,1712,Fantasy Sports 4 Life,http://fantasysports4life.org,Raising funding for medical causes through fantasy sports,Cumming,USA,Fans & Content,Fantasy Sports & Betting
5641,1713,Fantasy Sports Betting,http://FantasySportsBetting.com,P2P multi sports betting,Scottsdale,USA,Fans & Content,Fantasy Sports & Betting
1121,1714,Fantasy Sports Company,http://FantasySportsCo.com,Daily Fantasy sports news & tips,Carlsbad,USA,Fans & Content,Fantasy Sports & Betting
1877,1715,Fantasy Sports Hero,http://fantasysportshero.com,Daily Fantasy sports news & tips,Denton,USA,Fans & Content,Fantasy Sports & Betting
6266,1716,Fantasy Sports Portal,http://fantasysp.com,Fantasy sports tips and news,Plaza,USA,Fans & Content,Fantasy Sports & Betting
3472,1717,Fantasy Sports Ventures,http://fantasysportsventures.com,Web properties creator for Sports teams,New York City,USA,Management & Organisation,Organisations & Venues
2719,1718,Fantasy Sports Weather,http://FantasySportsWeather.com,Fantasy sports news & tips,New York City,USA,Fans & Content,Fantasy Sports & Betting
4081,1719,Fantasy Sports777,http://fantasysports777.com,Fantasy sports platform,Mexico City,Mexico,Fans & Content,Fantasy Sports & Betting
5455,1720,Fantasy Team Advisors,http://fantasyteamadvisors.com,Daily fantasy sports strategy and tips,Ottumwa,USA,Fans & Content,Fantasy Sports & Betting
67,1721,Fantasy football scout,http://fantasyfootballscout.co.uk,"Fantasy Premier League tips, news, advice and data",Southend-on-sea,UK,Fans & Content,Fantasy Sports & Betting
4819,1722,FantasyBet,http://fantasybet.com,Real money fantasy sports,Bristol,UK,Fans & Content,Fantasy Sports & Betting
3187,1723,FantasyCruncher,http://fantasycruncher.com,Fantasy sports tips and news,Los Angeles,USA,Fans & Content,Fantasy Sports & Betting
4782,1724,FantasyData,http://fantasydata.com,Fantasy sports tips and news,West,USA,Fans & Content,Fantasy Sports & Betting
2235,1725,FantasyDraft,http://fantasydraft.com,Daily fantasy sports,Charlotte,USA,Fans & Content,Fantasy Sports & Betting
2247,1726,FantasyEsports.gg,http://fantasyesports.gg,Esports fantasy platform,Melbourne,Australia,Fans & Content,Fantasy Sports & Betting
3571,1727,FantasyLife,http://fantasylife.com,"Fantasy sports and sports betting media company,",Delaware City,USA,Fans & Content,Fantasy Sports & Betting
4777,1728,FantasyMeter,http://fantasymeter.com,Digital marketing solutions for Fantasy sports providers,Dallas,USA,Fans & Content,Fantasy Sports & Betting
3728,1729,FantasyPros,http://fantasypros.com,Fantasy sports platform,Las Vegas,USA,Fans & Content,Fantasy Sports & Betting
3963,1730,FantasySpin,http://fantasyspin.com,"Fantasy sports tips, analytics & tools",Montreal,Canada,Fans & Content,Fantasy Sports & Betting
4546,1731,FantasySports,http://fantasysports.com,Daily fantasy sports,Newport Beach,USA,Fans & Content,Fantasy Sports & Betting
5673,1732,Fantazzle,http://fantazzle.com,Daily fantasy sports,Arlington,USA,Fans & Content,Fantasy Sports & Betting
3995,1733,Fantex,http://fantex.com,Online stock exchange to invest in your favourite sports teams,San Francisco,USA,Fans & Content,Fan Experiences
4192,1734,Fantium,http://fantium.com,"FANtium is the leading platform where FANs can invest in athletes they believe in, connect with them",Berlin,Germany,Fans & Content,Fan Experiences
5533,1735,Fantom,http://global.getfantom.com,World's first smartwatch only for football fans.,London,UK,Activity & Performance,For Activity Hardware
1845,1736,Fantomic,http://fantomic.com,A mobile app for connecting football fans,Aachen,Germany,Fans & Content,Fan Experiences
1039,1737,Fantrax,http://fantrax.com,Fantasy sports platform,Markham,Canada,Fans & Content,Fantasy Sports & Betting
6261,1738,Fantronics,http://Fantronics.com,Fan engagement through wearables and merchandise,Indianapolis,USA,Fans & Content,Fan Experiences
3596,1739,"Fanvest Wagering Exchange, Inc.",http://fanvestwageringexchange.com,Online stock exchange to invest in your favourite sports teams,Washington D.C.,USA,Fans & Content,Fantasy Sports & Betting
1722,1740,Fanview,http://fanviewtv.com,Video streaming platform to view your favourite american sports documentaries,Los Angeles,USA,Fans & Content,Content Platforms
3588,1741,Fanzeal,http://fanzeal.com,Social media platform for sports fans,Carlsbad,USA,Fans & Content,Fan Experiences
1319,1742,Fanzee,http://fanz.ee,Blockchain-based sports fan engagement platform,Philadelphia,USA,Activity & Performance,For Activity Software
2975,1743,Fanzeit,http://fanzeit.de,Football news media platform,Bochum,Germany,Fans & Content,Content Platforms
418,1744,Fanzo,http://fanzo.com,Sports content platform,London,UK,Fans & Content,Content Platforms
2110,1745,Fanzone Media,http://fanzone.io,Fanzone Media is a fan engagement platform with digital trading cards.,Berlin,Germany,Fans & Content,Fan Experiences
4585,1746,Fanzword,http://fanzword.com,"Football Fans' Social Network. Discuss Football Matches, Share your Opinion, Earn Points & Get Rewarded",Dubai,UAE,Fans & Content,Fan Experiences
2597,1747,Fanzy Cricket,http://fanzy.in,Fantasy cricket platform,Bangalore,India,Fans & Content,Fantasy Sports & Betting
5046,1748,FasCat Coaching,http://fascatcoaching.com,Online on demand cycling classes and tutorials,Boulder,USA,Activity & Performance,For Activity Software
4327,1749,Fast Break Labs,http://fastbreaklabs.com,Building the future of sports gaming and entertainment,San Francisco,USA,Fans & Content,Fantasy Sports & Betting
2011,1750,Fast Pong AI,http://fastpong.ai,Interactive table tennis training device,Seoul,South Korea,Activity & Performance,For Activity Hardware
342,1751,Fast Track Timing,http://fasttracktiming.com,SaaS platform to manage race timing and participant information,South Kent,USA,Management & Organisation,Organisations & Venues
4701,1752,FastChart Sports,http://fastchartsports.com,Charting app and coaching tool,Knoxville,USA,Activity & Performance,For Activity Software
4532,1753,FastFantasy,http://fastfantasy.com,Daily fantasy sports platform,Washington D.C.,USA,Fans & Content,Fantasy Sports & Betting
74,1754,FastModel Sports,http://fastmodelsports.com,Solutions for coaches to better manage their training and coaching analysis,Chicago,USA,Activity & Performance,Before / After Activity
3826,1755,Fastbreak,http://fastbreak.ai,Building the world’s fastest and most robust sports scheduling & logistics platform,Charlotte,USA,Activity & Performance,Before / After Activity
240,1756,Fastpong,http://fastpong.com,FastPong is an interactive table tennis training board using LED lighting and feedback system,Seoul,South Korea,Activity & Performance,For Activity Hardware
4813,1757,Fatigue Science,http://fatiguescience.com,Predictive fatigue management,Vancouver,Canada,Activity & Performance,For Activity Hardware
681,1758,Fayble,http://fayble.com,Interactive AI generated sports games,Berkeley,USA,Fans & Content,Fantasy Sports & Betting
130,1759,Fb-ninja,http://fb-ninja.com,Advanced tools for fantasy basketball.,Poland,USA,Fans & Content,Fantasy Sports & Betting
5729,1760,"FeedbacK Enterprise, LLC",http://feedback-coach.com,Biometric motion capture technologies & Artificial Intelligence (AI) to help people improve at any repeatable motion,Hampton,USA,Activity & Performance,Before / After Activity
1774,1761,Feel VR,http://feelvr.game,"Gaming hardware products, particularly for VR",Walnut Creek,USA,Activity & Performance,For Activity Hardware
2997,1762,FeetApart,http://feetapart.com,Web platform and mobile app that induces employee fitness solution,Bangalore,India,Activity & Performance,For Activity Software
4917,1763,Female Cricket,http://femalecricket.com,First-ever platform dedicated to women's cricket around the World.,Mumbai,India,Fans & Content,Content Platforms
1523,1764,Fenway Ticket King,http://fenwayticketking.com,Ticketing platform for all sports events at Fenway Park,Plymouth,USA,Fans & Content,Fan Experiences
4591,1765,FiNC,http://finc.com,Personal AI based fitness and workouts trainer,Tokyo,Japan,Activity & Performance,For Activity Software
170,1766,FiXi,http://fixionline.com,FiXi is committed to building software of the highest quality.,Melbourne,Australia,Management & Organisation,Organisations & Venues
493,1767,Fibodo,http://fibodo.com,"an online platform for booking coaches, instructors, and personal trainers for sports activity.",London,UK,Activity & Performance,Before / After Activity
4189,1768,FidGrit,http://fidgrit.com,Sports and Sports Event Management platform.,Los Angeles,USA,Management & Organisation,Organisations & Venues
514,1769,Field of Dreams (FOD),http://fod.digital,Field of Dreams (FOD) is a free-to-play fantasy sports platform that aims to enable cross-league and cross-sport interaction and create a community-driven experience while breaking down traditional fantasy sports barriers.,Hong Kong,Hong Kong,Fans & Content,Fantasy Sports & Betting
4394,1770,Field of Vision,http://fov.ie,AI to make football interactive,Dublin,Ireland,Fans & Content,Fan Experiences
2482,1771,FieldLevel,http://fieldlevel.com,Helps athletes find the right teams and coaches find the best talent for their rosters,Santa Monica,USA,Activity & Performance,Before / After Activity
4609,1772,Fieldoo,http://fieldoo.com,Football career network for football players to promote themselves and showcase their skills to agents and scouts,Ljubljana,Slovenia,Activity & Performance,Before / After Activity
1356,1773,Fight Analytics,http://fightanalytics.cc,Fight Analytics is a sports data company specialized in real time and statistics web products.,Porto Alegre,Brazil,Activity & Performance,For Activity Software
2797,1774,Fight Network,http://fightnetwork.com,"Broadcasts related to combat sports, including mixed martial arts, boxing, kickboxing, and professional wrestling.",Toronto,Canada,Fans & Content,Content Platforms
782,1775,FightBox,http://fightbox.com,24hr combat sports channel available worldwide,London,UK,Fans & Content,Content Platforms
50,1776,FightCamp,http://joinfightcamp.com,On-demand boxing and HIIT workouts with motion trackers on your wrists,Costa Mesa,USA,Activity & Performance,For Activity Hardware
5326,1777,FightCreed,http://fightcreed.com,Fight and combat sports news and live results platform,Toronto,Canada,Fans & Content,Content Platforms
5011,1778,FightRep,http://fightrep.com,"A mobile application for smart and transparent matchmaking to boxing, kickboxing, MMA and other martial arts.",Ghent,Belgium,Activity & Performance,Before / After Activity
3008,1779,Fightout,http://fightout.com,Building a fitness app and high-end gym chain.,London,UK,Activity & Performance,For Activity Software
96,1780,Fightscout,http://fightscout.app,Allows fighters to explore and connect to the entire Combat Sports Community around the world,Sofia,Bulgaria,Activity & Performance,Before / After Activity
370,1781,Figur8,http://figur8tech.com,On-body movement intelligence solution for evaluating musculoskeletal health,Boston,USA,Activity & Performance,Before / After Activity
543,1782,Fiit,http://fiit.tv,Real-time performance feedback and live leader boards that allows users to challenge their friends from around the world,London,UK,Activity & Performance,For Activity Software
970,1783,Fiitli,http://fiitli.com,Platform to introduce sport and well being in businessess,Nantes,France,Management & Organisation,Organisations & Venues
4298,1784,Film Your Team,http://filmyourteam.strikingly.com,Automatic and intelligent summaries of your team sports matches,Paris,France,Activity & Performance,For Activity Software
3804,1785,Filmily,http://filmi.ly,Fan Based Content Platform for capturing video,Totnes,UK,Management & Organisation,Media & Sponsors
2602,1786,Finalap,http://finalap.com,SaaS platform to manage race timing and participant information,Bogota,Colombia,Management & Organisation,Organisations & Venues
3208,1787,"Find A Game, Inc.",http://FindAGame.io,Golf course management software to attract and retain players,San Francisco,USA,Management & Organisation,Organisations & Venues
2770,1788,Find Discovery,http://diving-market.com,Find Discovery is a software application firm that aims to use AI technology to help revitalize the diving indsutry.,Tokyo,Japan,Activity & Performance,For Activity Hardware
454,1789,Find Me Football,http://findmefootball.com,An app building an amateur football community and network,-,-,Activity & Performance,Before / After Activity
4136,1790,Find Your Fitcoach,http://findyourfitcoach.com,Find Your Fitcoach is an online platform for personal trainers and athletes.,Amsterdam,The Netherlands,Activity & Performance,Before / After Activity
1841,1791,Find Your Rival,http://FindYourRival.com,Basketball community platform,Corona,USA,Activity & Performance,Before / After Activity
1351,1792,Find Your Trainer,http://findyourtrainer.com,An online marketplace for finding a vetted and certified personal trainer,New York City,USA,Activity & Performance,Before / After Activity
1395,1793,Find a Player,http://findaplayer.com,App to connect with sports people & games in local areas,Glasgow,UK,Activity & Performance,Before / After Activity
1971,1794,Find a Race,http://findarace.com,Platform to find events related to endurance sports,London,UK,Activity & Performance,Before / After Activity
982,1795,Findsomebuddy,http://findsomebuddy.de,"AI driven interactive sports platform that provides you with suitable sports partners, venues, vendors, and communities",Berlin,Germany,Activity & Performance,Before / After Activity
3368,1796,Finis,http://finisswim.com,Smart swim goggles,Livermore,USA,Activity & Performance,For Activity Hardware
4254,1797,FinisherBox,http://finisherbox.es,"An ecommerce platform for in race breaks and gift boxes of experiences for runners, cyclists and triathletes.",Barcelona,Spain,Activity & Performance,For Activity Software
3818,1798,Finishers,http://finishers.com,A site for runners to find and book marathons and other races around the world,Lyon,France,Activity & Performance,Before / After Activity
760,1799,FireFan,http://firefan.com,Online fantasy gaming and rewards platform,Orem,USA,Fans & Content,Fantasy Sports & Betting
2756,1800,Firefly Recover,http://RecoveryFirefly.com,provider of a recovery device for delayed onset muscle soreness (DOMS) relief.,Fullerton,USA,Activity & Performance,For Activity Hardware
3377,1801,Firld,http://firld.com,"Sport market analytics, value estimations and rankings",Moscow,Russia,Management & Organisation,Organisations & Venues
6034,1802,First Class Personal Training,http://firstclasspt.se,An app based personal training platform,Malmo,Sweden,Activity & Performance,For Activity Software
5619,1803,First Pick,http://first-pick.com,Interactive method to enjoy the major professional sports leagues' amateur drafts,State College,USA,Fans & Content,Fantasy Sports & Betting
5514,1804,First Sports,http://first-sports.com,A leading provider of sports software products & consulting services worldwide.,Walton On Thames,UK,Management & Organisation,Organisations & Venues
393,1805,FirstBlood,http://firstblood.io,"An automated tournament platform to track your success, earn rewards, and make your name in the competitive community",Boston,USA,Management & Organisation,Organisations & Venues
1693,1806,FirstDown PlayBook,http://firstdownplaybook.com,Digital playbook reference tool,Austin,USA,Activity & Performance,Before / After Activity
5939,1807,Firstbeat,http://firstbeat.com,"Leading provider of physiological analytics for sports, fitness, performance and wellbeing.",Jyvaskyla,Finland,Activity & Performance,For Activity Software
1659,1808,FishAngler,http://fishangler.com,"Platform for fishing enthusiasts to explore, catch, and connect on one platform",Fort Lauderdale,USA,Activity & Performance,For Activity Software
3163,1809,Fishbrain,http://fishbrain.com,"Fishing trip planning, data recording on personal log with crowdsourced contours",Stockholm,Sweden,Activity & Performance,For Activity Software
842,1810,Fishency,http://fishency.no,Software solution using AI for the aquaculture industry,Stavanger,Norway,Activity & Performance,For Activity Software
2242,1811,FishingBooker,http://fishingbooker.com,Online marketplace for booking fishing trips,Norfolk,USA,Activity & Performance,Before / After Activity
2041,1812,FishingScout,http://fishingscout.com,"An intelligent, authoritative map based social and mobile platform for fishing enthusiasts",Austin,USA,Activity & Performance,For Activity Software
1850,1813,Fit,http://fit.cam,AI Powered fitness trainer and workout tracker,New York City,USA,Activity & Performance,For Activity Software
229,1814,Fit Factory Fitness,http://fitfactoryfitness.com,A personal training and boot camp fitness service,Toronto,Canada,Activity & Performance,Before / After Activity
4693,1815,Fit For 90,http://fitfor90.com,A sports Performance & Injury Prevention Software,Durham,USA,Activity & Performance,Before / After Activity
1652,1816,Fit For Battle,http://fitforbattle.net,"a fun running app that transforms walk, jog, or run into an epic adventure",Newcastle,Australia,Fans & Content,Fantasy Sports & Betting
3996,1817,Fit Gurus,http://fitgurus.com,A personal training and boot camp fitness service,Newcastle,UK,Activity & Performance,For Activity Software
2293,1818,Fit Hub,http://fithub.io,"Web based fitness application which allows you to build, explore and train workout programs",Toronto,Canada,Activity & Performance,For Activity Software
6405,1819,Fit Mix,http://fitmixonline.com,A modern gym membership providing access to multiple gyms,Rio Rancho,USA,Activity & Performance,Before / After Activity
126,1820,Fit Shuffle,http://fitshuffle.com,Fitness and workout videos on a mobile app,Reno,USA,Activity & Performance,For Activity Software
6265,1821,Fit&Beat,http://fit-beat.io,Fit&Beat creats a licencing model for personal trainers based on blockchain and utilising XR technology to transform the fitness industry.,Ljubljana,Slovenia,Activity & Performance,For Activity Software
877,1822,Fit.Live,http://fit.live,Live fitness and workout platform and app,London,UK,Activity & Performance,For Activity Software
3053,1823,Fit3D,http://fit3d.com,3D Body scanner for avatars and body transformation tracking,Redwood City,USA,Activity & Performance,For Activity Hardware
5262,1824,"FitChirp - A positive, educational, collaborative health & fitness sharing community.",http://FitChirp.com,Social platform for fitness enthusiasts to share and track information,Mountain View,USA,Fans & Content,Fan Experiences
5744,1825,FitCircle,http://fitcircle.in,Clean Nutrition Products and an AI Powered Fitness Companion,Mumbai,India,Activity & Performance,For Activity Software
3663,1826,FitCity,http://fitcity.in,"Workout anytime, anywhere across premium fitness studios in India",Ahmedabad,India,Activity & Performance,Before / After Activity
556,1827,FitDrive,http://myfitdrive.com,FitDrive is a fitness App that provides online training to the clients.,Toronto,Canada,Activity & Performance,For Activity Software
4070,1828,FitFight,http://fitfightme.com,FitFight is a combat veteran owned and operated mobile platform,New York City,USA,Fans & Content,Fan Experiences
100,1829,FitFlo,http://fitfloapp.com,"A software system that powers the connected in-gym experience for Operators, Trainers and Members",Melbourne,Australia,Management & Organisation,Organisations & Venues
5021,1830,FitGrid,http://fitgrid.com,"FitGrid offers management software that helps in connecting staff, instructors and studio owners through a learning and recommendation grid.",New York City,USA,Fans & Content,Fan Experiences
1491,1831,FitIn,http://fitin.io,Fitness/wellness marketplace + business management software,Toronto,Canada,Activity & Performance,For Activity Software
